ffff92ff231cf480 3440731308 C Ii:1:009:1 0:1 8 = 00000000 00000000
ffff92ff231cf480 3440731334 S Ii:1:009:1 -115:1 8 <
ffff92ff231cf480 3441465307 C Ii:1:009:1 0:1 8 = 00006500 00000000
ffff92ff231cf480 3441465325 S Ii:1:009:1 -115:1 8 <
ffff92ff211c13c0 3441473653 S Co:1:009:0 s 21 09 0200 0000 0040 64 = 12ff0c3a 00400005 03000000 05000000 04000000 02000000 01000000 00000000
ffff92ff211c13c0 3441473931 C Co:1:009:0 0 64 >
ffff92ff211c13c0 3441473956 S Co:1:009:0 s 21 09 0200 0000 0040 64 = 12ff0c3a 0001000e 3a000000 3b000000 3c000000 3d000000 3e000000 3f000000
ffff92ff211c13c0 3441474302 C Co:1:009:0 0 64 >
ffff92ff211c13c0 3441474326 S Co:1:009:0 s 21 09 0200 0000 0040 64 = 12ff0c3a 0001000e 47000000 48000000 49000000 4c000000 4a000000 4d000000
ffff92ff211c13c0 3441474552 C Co:1:009:0 0 64 >
ffff92ff211c13c0 3441474576 S Co:1:009:0 s 21 09 0200 0000 0040 64 = 12ff0c3a 0001000e e3000000 e2000000 e6000000 e7000000 e4000000 e5000000
ffff92ff211c13c0 3441474803 C Co:1:009:0 0 64 >
ffff92ff211c13c0 3441474826 S Co:1:009:0 s 21 09 0200 0000 0040 64 = 12ff0c3a 0001000e 0b000000 0c000000 0d000000 0e000000 0f000000 10000000
ffff92ff211c1cc0 3441475179 C Ii:1:009:2 0:1 20 = 11ff0c3a 0001000e 00000000 00000000 00000000
ffff92ff211c1cc0 3441475189 S Ii:1:009:2 -115:1 64 <
ffff92ff211c13c0 3441475192 C Co:1:009:0 0 64 >
ffff92ff211c13c0 3441475212 S Co:1:009:0 s 21 09 0200 0000 0040 64 = 12ff0c3a 0001000e 19000000 1a000000 1b000000 1c000000 1d000000 1e000000
ffff92ff211c13c0 3441475552 C Co:1:009:0 0 64 >
ffff92ff211c13c0 3441475576 S Co:1:009:0 s 21 09 0200 0000 0040 64 = 12ff0c3a 0001000e 27000000 28000000 2a000000 2b000000 2c000000 2d000000
ffff92ff211c13c0 3441475790 C Co:1:009:0 0 64 >
ffff92ff211c13c0 3441475803 S Co:1:009:0 s 21 09 0200 0000 0040 64 = 12ff0c3a 0001000e 36000000 37000000 38000000 39000000 64000000 00000000
ffff92ff211c1cc0 3441476179 C Ii:1:009:2 0:1 20 = 11ff0c3a 0001000e 00000000 00000000 00000000
ffff92ff211c1cc0 3441476187 S Ii:1:009:2 -115:1 64 <
ffff92ff211c13c0 3441476190 C Co:1:009:0 0 64 >
ffff92ff211c13c0 3441476218 S Co:1:009:0 s 21 09 0200 0000 0014 20 = 11ff0c5a 00000000 00000000 00000000 00000000
ffff92ff211c13c0 3441476427 C Co:1:009:0 0 20 >
ffff92ff211c13c0 3441476474 S Co:1:009:0 s 21 09 0200 0000 0040 64 = 12ff0c3a 0001000e e5ffff00 280000ff 1e0000ff 520000ff 100000ff 130000ff
ffff92ff211c13c0 3441476775 C Co:1:009:0 0 64 >
ffff92ff211c13c0 3441476786 S Co:1:009:0 s 21 09 0200 0000 0040 64 = 12ff0c3a 0001000e 270000ff 220000ff 210000ff 0a0000ff 170000ff 510000ff
ffff92ff211c1cc0 3441477176 C Ii:1:009:2 0:1 20 = 11ff0c3a 0001000e 00000000 00000000 00000000
ffff92ff211c1cc0 3441477184 S Ii:1:009:2 -115:1 64 <
ffff92ff211c13c0 3441477187 C Co:1:009:0 0 64 >
ffff92ff211c13c0 3441477214 S Co:1:009:0 s 21 09 0200 0000 0014 20 = 11ff0c5a 00000000 00000000 00000000 00000000
ffff92ff211c13c0 3441477428 C Co:1:009:0 0 20 >
ffff92ff211c1cc0 3441478301 C Ii:1:009:2 0:1 20 = 11ff0c5a 00000000 00000000 00000000 00000000
ffff92ff211c1cc0 3441478310 S Ii:1:009:2 -115:1 64 <
ffff92ff211c1cc0 3441479301 C Ii:1:009:2 0:1 20 = 11ff0c5a 00000000 00000000 00000000 00000000
ffff92ff211c1cc0 3441479309 S Ii:1:009:2 -115:1 64 <
ffff92ff211c1cc0 3441480302 C Ii:1:009:2 0:1 20 = 11ff0c3a 0001000e 00000000 00000000 00000000
ffff92ff211c1cc0 3441480311 S Ii:1:009:2 -115:1 64 <
ffff92ff231cf480 3441701314 C Ii:1:009:1 0:1 8 = 00006552 00000000
ffff92ff231cf480 3441701335 S Ii:1:009:1 -115:1 8 <
ffff92ff231cf480 3441741302 C Ii:1:009:1 0:1 8 = 00006500 00000000
ffff92ff231cf480 3441741319 S Ii:1:009:1 -115:1 8 <
ffff92ff231cf480 3442078301 C Ii:1:009:1 0:1 8 = 00000000 00000000
ffff92ff231cf480 3442078315 S Ii:1:009:1 -115:1 8 <
ffff92ff211c13c0 3442090235 S Co:1:009:0 s 21 09 0200 0000 0040 64 = 12ff0c3a 00400005 03000000 05000000 04000000 02000000 01000000 00000000
ffff92ff211c13c0 3442090562 C Co:1:009:0 0 64 >
ffff92ff211c13c0 3442090594 S Co:1:009:0 s 21 09 0200 0000 0040 64 = 12ff0c3a 0001000e 3a000000 3b000000 3c000000 3d000000 3e000000 3f000000
ffff92ff211c13c0 3442090934 C Co:1:009:0 0 64 >
ffff92ff211c13c0 3442090968 S Co:1:009:0 s 21 09 0200 0000 0040 64 = 12ff0c3a 0001000e 47000000 48000000 49000000 4c000000 4a000000 4d000000
ffff92ff211c13c0 3442091309 C Co:1:009:0 0 64 >
ffff92ff211c13c0 3442091345 S Co:1:009:0 s 21 09 0200 0000 0040 64 = 12ff0c3a 0001000e e3000000 e2000000 e6000000 e7000000 e4000000 e5000000
ffff92ff211c13c0 3442091683 C Co:1:009:0 0 64 >
ffff92ff211c13c0 3442091720 S Co:1:009:0 s 21 09 0200 0000 0040 64 = 12ff0c3a 0001000e 0b000000 0c000000 0d000000 0e000000 0f000000 10000000
ffff92ff211c13c0 3442092052 C Co:1:009:0 0 64 >
ffff92ff211c13c0 3442092089 S Co:1:009:0 s 21 09 0200 0000 0040 64 = 12ff0c3a 0001000e 19000000 1a000000 1b000000 1c000000 1d000000 1e000000
ffff92ff211c1cc0 3442092310 C Ii:1:009:2 0:1 20 = 11ff0c3a 0001000e 00000000 00000000 00000000
ffff92ff211c1cc0 3442092320 S Ii:1:009:2 -115:1 64 <
ffff92ff211c13c0 3442092323 C Co:1:009:0 0 64 >
ffff92ff211c13c0 3442092352 S Co:1:009:0 s 21 09 0200 0000 0040 64 = 12ff0c3a 0001000e 27000000 28000000 2a000000 2b000000 2c000000 2d000000
ffff92ff211c13c0 3442092684 C Co:1:009:0 0 64 >
ffff92ff211c13c0 3442092720 S Co:1:009:0 s 21 09 0200 0000 0040 64 = 12ff0c3a 0001000e 36000000 37000000 38000000 39000000 64000000 00000000
ffff92ff211c13c0 3442093059 C Co:1:009:0 0 64 >
ffff92ff211c13c0 3442093095 S Co:1:009:0 s 21 09 0200 0000 0014 20 = 11ff0c5a 00000000 00000000 00000000 00000000
ffff92ff211c1cc0 3442093307 C Ii:1:009:2 0:1 20 = 11ff0c3a 0001000e 00000000 00000000 00000000
ffff92ff211c1cc0 3442093317 S Ii:1:009:2 -115:1 64 <
ffff92ff211c13c0 3442093321 C Co:1:009:0 0 20 >
ffff92ff211c13c0 3442093353 S Co:1:009:0 s 21 09 0200 0000 0040 64 = 12ff0c3a 0001000e 65ffff00 e5ffff00 00000000 00000000 00000000 00000000
ffff92ff211c13c0 3442093684 C Co:1:009:0 0 64 >
ffff92ff211c13c0 3442093720 S Co:1:009:0 s 21 09 0200 0000 0014 20 = 11ff0c5a 00000000 00000000 00000000 00000000
ffff92ff211c13c0 3442093935 C Co:1:009:0 0 20 >
ffff92ff211c1cc0 3442094308 C Ii:1:009:2 0:1 20 = 11ff0c3a 0001000e 00000000 00000000 00000000
ffff92ff211c1cc0 3442094318 S Ii:1:009:2 -115:1 64 <
ffff92ff211c1cc0 3442095310 C Ii:1:009:2 0:1 20 = 11ff0c5a 00000000 00000000 00000000 00000000
ffff92ff211c1cc0 3442095321 S Ii:1:009:2 -115:1 64 <
ffff92ff211c1cc0 3442096307 C Ii:1:009:2 0:1 20 = 11ff0c5a 00000000 00000000 00000000 00000000
ffff92ff211c1cc0 3442096317 S Ii:1:009:2 -115:1 64 <
ffff92ff211c1cc0 3442097310 C Ii:1:009:2 0:1 20 = 11ff0c3a 0001000e 00000000 00000000 00000000
ffff92ff211c1cc0 3442097321 S Ii:1:009:2 -115:1 64 <
ffff92ff231cf480 3442586301 C Ii:1:009:1 0:1 8 = 20000000 00000000
ffff92ff231cf480 3442586317 S Ii:1:009:1 -115:1 8 <
ffff92ff211c13c0 3442589759 S Co:1:009:0 s 21 09 0200 0000 0040 64 = 12ff0c3a 00400005 03000000 05000000 04000000 02000000 01000000 00000000
ffff92ff211c13c0 3442590048 C Co:1:009:0 0 64 >
ffff92ff211c13c0 3442590073 S Co:1:009:0 s 21 09 0200 0000 0040 64 = 12ff0c3a 0001000e 3a000000 3b000000 3c000000 3d000000 3e000000 3f000000
ffff92ff211c13c0 3442590298 C Co:1:009:0 0 64 >
ffff92ff211c13c0 3442590324 S Co:1:009:0 s 21 09 0200 0000 0040 64 = 12ff0c3a 0001000e 47000000 48000000 49000000 4c000000 4a000000 4d000000
ffff92ff211c13c0 3442590548 C Co:1:009:0 0 64 >
ffff92ff211c13c0 3442590574 S Co:1:009:0 s 21 09 0200 0000 0040 64 = 12ff0c3a 0001000e e3000000 e2000000 e6000000 e7000000 e4000000 e5000000
ffff92ff211c13c0 3442590797 C Co:1:009:0 0 64 >
ffff92ff211c13c0 3442590824 S Co:1:009:0 s 21 09 0200 0000 0040 64 = 12ff0c3a 0001000e 0b000000 0c000000 0d000000 0e000000 0f000000 10000000
ffff92ff211c1cc0 3442591173 C Ii:1:009:2 0:1 20 = 11ff0c3a 00400005 00000000 00000000 00000000
ffff92ff211c1cc0 3442591183 S Ii:1:009:2 -115:1 64 <
ffff92ff211c13c0 3442591185 C Co:1:009:0 0 64 >
ffff92ff211c13c0 3442591214 S Co:1:009:0 s 21 09 0200 0000 0040 64 = 12ff0c3a 0001000e 19000000 1a000000 1b000000 1c000000 1d000000 1e000000
ffff92ff211c13c0 3442591548 C Co:1:009:0 0 64 >
ffff92ff211c13c0 3442591581 S Co:1:009:0 s 21 09 0200 0000 0040 64 = 12ff0c3a 0001000e 27000000 28000000 2a000000 2b000000 2c000000 2d000000
ffff92ff211c13c0 3442591923 C Co:1:009:0 0 64 >
ffff92ff211c13c0 3442591956 S Co:1:009:0 s 21 09 0200 0000 0040 64 = 12ff0c3a 0001000e 36000000 37000000 38000000 39000000 64000000 00000000
ffff92ff211c1cc0 3442592283 C Ii:1:009:2 0:1 20 = 11ff0c3a 0001000e 00000000 00000000 00000000
ffff92ff211c1cc0 3442592290 S Ii:1:009:2 -115:1 64 <
ffff92ff211c13c0 3442592292 C Co:1:009:0 0 64 >
ffff92ff211c13c0 3442592307 S Co:1:009:0 s 21 09 0200 0000 0014 20 = 11ff0c5a 00000000 00000000 00000000 00000000
ffff92ff211c13c0 3442592548 C Co:1:009:0 0 20 >
ffff92ff211c13c0 3442592587 S Co:1:009:0 s 21 09 0200 0000 0040 64 = 12ff0c3a 0001000e 65ffff00 510000ff 500000ff 4f0000ff 520000ff 00000000
ffff92ff211c13c0 3442592923 C Co:1:009:0 0 64 >
ffff92ff211c13c0 3442592956 S Co:1:009:0 s 21 09 0200 0000 0014 20 = 11ff0c5a 00000000 00000000 00000000 00000000
ffff92ff211c1cc0 3442593298 C Ii:1:009:2 0:1 20 = 11ff0c3a 0001000e 00000000 00000000 00000000
ffff92ff211c1cc0 3442593306 S Ii:1:009:2 -115:1 64 <
ffff92ff211c13c0 3442593309 C Co:1:009:0 0 20 >
ffff92ff211c1cc0 3442594297 C Ii:1:009:2 0:1 20 = 11ff0c5a 00000000 00000000 00000000 00000000
ffff92ff211c1cc0 3442594306 S Ii:1:009:2 -115:1 64 <
ffff92ff211c1cc0 3442595297 C Ii:1:009:2 0:1 20 = 11ff0c5a 00000000 00000000 00000000 00000000
ffff92ff211c1cc0 3442595306 S Ii:1:009:2 -115:1 64 <
ffff92ff211c1cc0 3442596298 C Ii:1:009:2 0:1 20 = 11ff0c3a 0001000e 00000000 00000000 00000000
ffff92ff211c1cc0 3442596307 S Ii:1:009:2 -115:1 64 <
ffff92ff231cf480 3443083305 C Ii:1:009:1 0:1 8 = 00000000 00000000
ffff92ff231cf480 3443083324 S Ii:1:009:1 -115:1 8 <
ffff92ff211c13c0 3443087867 S Co:1:009:0 s 21 09 0200 0000 0040 64 = 12ff0c3a 00400005 03000000 05000000 04000000 02000000 01000000 00000000
ffff92ff211c13c0 3443088170 C Co:1:009:0 0 64 >
ffff92ff211c13c0 3443088197 S Co:1:009:0 s 21 09 0200 0000 0040 64 = 12ff0c3a 0001000e 3a000000 3b000000 3c000000 3d000000 3e000000 3f000000
ffff92ff211c13c0 3443088419 C Co:1:009:0 0 64 >
ffff92ff211c13c0 3443088445 S Co:1:009:0 s 21 09 0200 0000 0040 64 = 12ff0c3a 0001000e 47000000 48000000 49000000 4c000000 4a000000 4d000000
ffff92ff211c13c0 3443088669 C Co:1:009:0 0 64 >
ffff92ff211c13c0 3443088696 S Co:1:009:0 s 21 09 0200 0000 0040 64 = 12ff0c3a 0001000e e3000000 e2000000 e6000000 e7000000 e4000000 e5000000
ffff92ff211c13c0 3443088920 C Co:1:009:0 0 64 >
ffff92ff211c13c0 3443088949 S Co:1:009:0 s 21 09 0200 0000 0040 64 = 12ff0c3a 0001000e 0b000000 0c000000 0d000000 0e000000 0f000000 10000000
ffff92ff211c1cc0 3443089268 C Ii:1:009:2 0:1 20 = 11ff0c3a 00400005 00000000 00000000 00000000
ffff92ff211c1cc0 3443089275 S Ii:1:009:2 -115:1 64 <
ffff92ff211c13c0 3443089277 C Co:1:009:0 0 64 >
ffff92ff211c13c0 3443089288 S Co:1:009:0 s 21 09 0200 0000 0040 64 = 12ff0c3a 0001000e 19000000 1a000000 1b000000 1c000000 1d000000 1e000000
ffff92ff211c13c0 3443089545 C Co:1:009:0 0 64 >
ffff92ff211c13c0 3443089572 S Co:1:009:0 s 21 09 0200 0000 0040 64 = 12ff0c3a 0001000e 27000000 28000000 2a000000 2b000000 2c000000 2d000000
ffff92ff211c13c0 3443089794 C Co:1:009:0 0 64 >
ffff92ff211c13c0 3443089820 S Co:1:009:0 s 21 09 0200 0000 0040 64 = 12ff0c3a 0001000e 36000000 37000000 38000000 39000000 64000000 00000000
ffff92ff211c1cc0 3443090170 C Ii:1:009:2 0:1 20 = 11ff0c3a 0001000e 00000000 00000000 00000000
ffff92ff211c1cc0 3443090180 S Ii:1:009:2 -115:1 64 <
ffff92ff211c13c0 3443090183 C Co:1:009:0 0 64 >
ffff92ff211c13c0 3443090206 S Co:1:009:0 s 21 09 0200 0000 0014 20 = 11ff0c5a 00000000 00000000 00000000 00000000
ffff92ff211c13c0 3443090420 C Co:1:009:0 0 20 >
ffff92ff211c13c0 3443090449 S Co:1:009:0 s 21 09 0200 0000 0040 64 = 12ff0c3a 0001000e 65ffff00 e5ffff00 00000000 00000000 00000000 00000000
ffff92ff211c13c0 3443090670 C Co:1:009:0 0 64 >
ffff92ff211c13c0 3443090696 S Co:1:009:0 s 21 09 0200 0000 0014 20 = 11ff0c5a 00000000 00000000 00000000 00000000
ffff92ff211c13c0 3443090920 C Co:1:009:0 0 20 >
ffff92ff211c1cc0 3443091294 C Ii:1:009:2 0:1 20 = 11ff0c3a 0001000e 00000000 00000000 00000000
ffff92ff211c1cc0 3443091303 S Ii:1:009:2 -115:1 64 <
ffff92ff211c1cc0 3443092294 C Ii:1:009:2 0:1 20 = 11ff0c5a 00000000 00000000 00000000 00000000
ffff92ff211c1cc0 3443092304 S Ii:1:009:2 -115:1 64 <
ffff92ff211c1cc0 3443093294 C Ii:1:009:2 0:1 20 = 11ff0c5a 00000000 00000000 00000000 00000000
ffff92ff211c1cc0 3443093303 S Ii:1:009:2 -115:1 64 <
ffff92ff211c1cc0 3443094294 C Ii:1:009:2 0:1 20 = 11ff0c3a 0001000e 00000000 00000000 00000000
ffff92ff211c1cc0 3443094304 S Ii:1:009:2 -115:1 64 <
ffff92ff231cf480 3443513305 C Ii:1:009:1 0:1 8 = 00006500 00000000
ffff92ff231cf480 3443513325 S Ii:1:009:1 -115:1 8 <
ffff92ff211c13c0 3443523300 S Co:1:009:0 s 21 09 0200 0000 0040 64 = 12ff0c3a 00400005 03000000 05000000 04000000 02000000 01000000 00000000
ffff92ff211c13c0 3443523546 C Co:1:009:0 0 64 >
ffff92ff211c13c0 3443523577 S Co:1:009:0 s 21 09 0200 0000 0040 64 = 12ff0c3a 0001000e 3a000000 3b000000 3c000000 3d000000 3e000000 3f000000
ffff92ff211c13c0 3443523923 C Co:1:009:0 0 64 >
ffff92ff211c13c0 3443523953 S Co:1:009:0 s 21 09 0200 0000 0040 64 = 12ff0c3a 0001000e 47000000 48000000 49000000 4c000000 4a000000 4d000000
ffff92ff211c13c0 3443524301 C Co:1:009:0 0 64 >
ffff92ff211c13c0 3443524334 S Co:1:009:0 s 21 09 0200 0000 0040 64 = 12ff0c3a 0001000e e3000000 e2000000 e6000000 e7000000 e4000000 e5000000
ffff92ff211c13c0 3443524677 C Co:1:009:0 0 64 >
ffff92ff211c13c0 3443524714 S Co:1:009:0 s 21 09 0200 0000 0040 64 = 12ff0c3a 0001000e 0b000000 0c000000 0d000000 0e000000 0f000000 10000000
ffff92ff211c13c0 3443525052 C Co:1:009:0 0 64 >
ffff92ff211c13c0 3443525089 S Co:1:009:0 s 21 09 0200 0000 0040 64 = 12ff0c3a 0001000e 19000000 1a000000 1b000000 1c000000 1d000000 1e000000
ffff92ff211c1cc0 3443525301 C Ii:1:009:2 0:1 20 = 11ff0c3a 0001000e 00000000 00000000 00000000
ffff92ff211c1cc0 3443525319 S Ii:1:009:2 -115:1 64 <
ffff92ff211c13c0 3443525322 C Co:1:009:0 0 64 >
ffff92ff211c13c0 3443525345 S Co:1:009:0 s 21 09 0200 0000 0040 64 = 12ff0c3a 0001000e 27000000 28000000 2a000000 2b000000 2c000000 2d000000
ffff92ff211c13c0 3443525677 C Co:1:009:0 0 64 >
ffff92ff211c13c0 3443525714 S Co:1:009:0 s 21 09 0200 0000 0040 64 = 12ff0c3a 0001000e 36000000 37000000 38000000 39000000 64000000 00000000
ffff92ff211c13c0 3443526050 C Co:1:009:0 0 64 >
ffff92ff211c13c0 3443526087 S Co:1:009:0 s 21 09 0200 0000 0014 20 = 11ff0c5a 00000000 00000000 00000000 00000000
ffff92ff211c1cc0 3443526301 C Ii:1:009:2 0:1 20 = 11ff0c3a 0001000e 00000000 00000000 00000000
ffff92ff211c1cc0 3443526319 S Ii:1:009:2 -115:1 64 <
ffff92ff211c13c0 3443526322 C Co:1:009:0 0 20 >
ffff92ff211c13c0 3443526359 S Co:1:009:0 s 21 09 0200 0000 0040 64 = 12ff0c3a 0001000e e5ffff00 280000ff 1e0000ff 520000ff 100000ff 130000ff
ffff92ff211c13c0 3443526677 C Co:1:009:0 0 64 >
ffff92ff211c13c0 3443526714 S Co:1:009:0 s 21 09 0200 0000 0040 64 = 12ff0c3a 0001000e 270000ff 220000ff 210000ff 0a0000ff 170000ff 510000ff
ffff92ff211c13c0 3443527051 C Co:1:009:0 0 64 >
ffff92ff211c13c0 3443527086 S Co:1:009:0 s 21 09 0200 0000 0014 20 = 11ff0c5a 00000000 00000000 00000000 00000000
ffff92ff211c1cc0 3443527301 C Ii:1:009:2 0:1 20 = 11ff0c3a 0001000e 00000000 00000000 00000000
ffff92ff211c1cc0 3443527319 S Ii:1:009:2 -115:1 64 <
ffff92ff211c13c0 3443527322 C Co:1:009:0 0 20 >
ffff92ff211c1cc0 3443528293 C Ii:1:009:2 0:1 20 = 11ff0c5a 00000000 00000000 00000000 00000000
ffff92ff211c1cc0 3443528304 S Ii:1:009:2 -115:1 64 <
ffff92ff211c1cc0 3443529301 C Ii:1:009:2 0:1 20 = 11ff0c5a 00000000 00000000 00000000 00000000
ffff92ff211c1cc0 3443529319 S Ii:1:009:2 -115:1 64 <
ffff92ff211c1cc0 3443530300 C Ii:1:009:2 0:1 20 = 11ff0c3a 0001000e 00000000 00000000 00000000
ffff92ff211c1cc0 3443530319 S Ii:1:009:2 -115:1 64 <
ffff92ff231cf480 3444087302 C Ii:1:009:1 0:1 8 = 00000000 00000000
ffff92ff231cf480 3444087321 S Ii:1:009:1 -115:1 8 <
ffff92ff211c13c0 3444088699 S Co:1:009:0 s 21 09 0200 0000 0040 64 = 12ff0c3a 00400005 03000000 05000000 04000000 02000000 01000000 00000000
ffff92ff211c13c0 3444089048 C Co:1:009:0 0 64 >
ffff92ff211c13c0 3444089078 S Co:1:009:0 s 21 09 0200 0000 0040 64 = 12ff0c3a 0001000e 3a000000 3b000000 3c000000 3d000000 3e000000 3f000000
ffff92ff211c13c0 3444089423 C Co:1:009:0 0 64 >
ffff92ff211c13c0 3444089453 S Co:1:009:0 s 21 09 0200 0000 0040 64 = 12ff0c3a 0001000e 47000000 48000000 49000000 4c000000 4a000000 4d000000
ffff92ff211c13c0 3444089799 C Co:1:009:0 0 64 >
ffff92ff211c13c0 3444089830 S Co:1:009:0 s 21 09 0200 0000 0040 64 = 12ff0c3a 0001000e e3000000 e2000000 e6000000 e7000000 e4000000 e5000000
ffff92ff211c1cc0 3444090172 C Ii:1:009:2 0:1 20 = 11ff0c3a 00400005 00000000 00000000 00000000
ffff92ff211c1cc0 3444090184 S Ii:1:009:2 -115:1 64 <
ffff92ff211c13c0 3444090187 C Co:1:009:0 0 64 >
ffff92ff211c13c0 3444090212 S Co:1:009:0 s 21 09 0200 0000 0040 64 = 12ff0c3a 0001000e 0b000000 0c000000 0d000000 0e000000 0f000000 10000000
ffff92ff211c13c0 3444090551 C Co:1:009:0 0 64 >
ffff92ff211c13c0 3444090583 S Co:1:009:0 s 21 09 0200 0000 0040 64 = 12ff0c3a 0001000e 19000000 1a000000 1b000000 1c000000 1d000000 1e000000
ffff92ff211c13c0 3444090922 C Co:1:009:0 0 64 >
ffff92ff211c13c0 3444090959 S Co:1:009:0 s 21 09 0200 0000 0040 64 = 12ff0c3a 0001000e 27000000 28000000 2a000000 2b000000 2c000000 2d000000
ffff92ff211c1cc0 3444091282 C Ii:1:009:2 0:1 20 = 11ff0c3a 0001000e 00000000 00000000 00000000
ffff92ff211c1cc0 3444091290 S Ii:1:009:2 -115:1 64 <
ffff92ff211c13c0 3444091292 C Co:1:009:0 0 64 >
ffff92ff211c13c0 3444091306 S Co:1:009:0 s 21 09 0200 0000 0040 64 = 12ff0c3a 0001000e 36000000 37000000 38000000 39000000 64000000 00000000
ffff92ff211c13c0 3444091527 C Co:1:009:0 0 64 >
ffff92ff211c13c0 3444091543 S Co:1:009:0 s 21 09 0200 0000 0014 20 = 11ff0c5a 00000000 00000000 00000000 00000000
ffff92ff211c13c0 3444946049 C Co:1:009:0 -32 0
ffff92ff211c1cc0 3444948312 C Ii:1:009:2 -71:1 0
ffff92ff231cf480 3444948318 C Ii:1:009:1 -71:1 0
ffff92ff231cf480 3444968014 S Ii:1:009:1 -115:1 8 <
ffff92ff211c1cc0 3444968031 S Ii:1:009:2 -115:1 64 <
ffff92ff211c1cc0 3444971299 C Ii:1:009:2 -71:1 0
ffff92ff231cf480 3444971305 C Ii:1:009:1 -71:1 0
ffff92ff231cf480 3445000015 S Ii:1:009:1 -115:1 8 <
ffff92ff211c1cc0 3445000029 S Ii:1:009:2 -115:1 64 <
ffff92ff211c1cc0 3445003310 C Ii:1:009:2 -71:1 0
ffff92ff231cf480 3445003316 C Ii:1:009:1 -71:1 0
ffff92ff231cf480 3445056009 S Ii:1:009:1 -115:1 8 <
ffff92ff211c1cc0 3445056021 S Ii:1:009:2 -115:1 64 <
ffff92ff211c1cc0 3445059300 C Ii:1:009:2 -71:1 0
ffff92ff231cf480 3445059305 C Ii:1:009:1 -71:1 0
